[
  {
    "serial_number": "97123456",
    "registration_number": null,
    "mark_text": "FRESH BITE",
    "mark_type": "STANDARD",
    "status": "DEAD",
    "status_code": "602",
    "status_date": "2024-03-15",
    "filing_date": "2023-01-10",
    "registration_date": null,
    "abandonment_date": "2024-03-15",
    "filing_basis": ["1B"],
    "classes": [43],
    "goods_services": "Restaurant services; cafe services; snack bar services",
    "owner_name": "Fresh Bite LLC",
    "owner_type": "LLC",
    "attorney_name": null,
    "design_codes": []
  },
  {
    "serial_number": "88654321",
    "registration_number": "6543210",
    "mark_text": "COCA-COLA",
    "mark_type": "STANDARD",
    "status": "LIVE",
    "status_code": "800",
    "status_date": "1893-01-31",
    "filing_date": "1892-06-28",
    "registration_date": "1893-01-31",
    "abandonment_date": null,
    "filing_basis": ["1A"],
    "classes": [32],
    "goods_services": "Soft drinks, namely, cola",
    "owner_name": "The Coca-Cola Company",
    "owner_type": "CORPORATION",
    "attorney_name": "King & Spalding LLP",
    "design_codes": []
  },
  {
    "serial_number": "97999888",
    "registration_number": null,
    "mark_text": "TECHFLOW AI",
    "mark_type": "STANDARD",
    "status": "PENDING",
    "status_code": "400",
    "status_date": "2024-11-01",
    "filing_date": "2024-10-15",
    "registration_date": null,
    "abandonment_date": null,
    "filing_basis": ["1B"],
    "classes": [9, 42],
    "goods_services": "Computer software for artificial intelligence | Software as a service (SAAS) featuring artificial intelligence",
    "owner_name": "TechFlow Inc.",
    "owner_type": "CORPORATION",
    "attorney_name": "IP Law Group PLLC",
    "design_codes": []
  }
]
